{
  "schema_version": 1,
  "source": {
    "id": "replace-with-source-id", "revision": "1", "title": "",
    "url": null, "creators": [], "publication_date": null,
    "source_type": "video", "supplied_material": ["transcript"],
    "source_sha256": null,
    "rights": {"raw_redistribution": "unknown", "basis": null}
  },
  "extraction": {
    "state": "partial", "model": null, "run_date": null,
    "review": {"status": "needs_review", "reviewer": null, "date": null, "notes": ""}
  },
  "segments": [], "claims": [], "relationships": [], "procedures": [], "conflicts": [],
  "coverage": {
    "input_scope": "", "supplied_segment_count": 0, "reviewed_segment_count": 0,
    "missing_modalities": [], "unprocessed_segment_ids": [], "notes": ""
  },
  "integration": {
    "comparison_status": "not_provided", "existing_revision": null,
    "existing_record_ids": [], "proposed_changes": []
  },
  "resume": {"next_segment_ids": [], "missing_input": [], "notes": ""}
}
